{
  "role_id": "sample-eu-only-remote",
  "company": "Example EU",
  "title": "Senior Backend Engineer",
  "job_url": "https://jobs.ashbyhq.com/example-eu/sample",
  "ats": "ashby",
  "source_timestamp": "2026-06-13T00:00:00Z",
  "location": "Remote EU only",
  "remote": {
    "status": "regional",
    "allowed_regions": ["EU"]
  },
  "sponsorship": {
    "status": "not_required",
    "evidence": "Posting states the role is remote within the EU only."
  },
  "required_skills": ["Python"],
  "preferred_skills": [],
  "required_questions": []
}
