{
  "role_id": "claim-demo-platform",
  "company": "Example Platform Co",
  "title": "Platform Engineer",
  "job_url": "https://jobs.ashbyhq.com/example-platform/claim-demo",
  "ats": "ashby",
  "source_timestamp": "2026-06-13T00:00:00Z",
  "location": "Remote",
  "remote": {
    "status": "global",
    "allowed_regions": ["global"]
  },
  "sponsorship": {
    "status": "not_required",
    "evidence": "Global remote contractor setup supported."
  },
  "required_skills": ["Kubernetes", "Terraform", "AWS"],
  "preferred_skills": ["Python"],
  "required_questions": []
}
